URL,Version,Status,OIDs,Name,Title,Description,Used
http://hl7.org/fhir/CodeSystem/medicationrequest-intent,4.0.1,draft,"2.16.840.1.113883.4.642.4.1378",medicationRequest Intent,Medication request  intent,"MedicationRequest Intent Codes","ValueSet/medicationrequest-intent"
http://hl7.org/fhir/CodeSystem/medicationrequest-status,4.0.1,draft,"2.16.840.1.113883.4.642.4.1377",medicationrequest Status,Medicationrequest  status,"MedicationRequest Status Codes","ValueSet/medicationrequest-status"
http://hl7.org/fhir/care-team-status,4.0.1,draft,"2.16.840.1.113883.4.642.4.154",CareTeamStatus,CareTeamStatus,"Indicates the status of the care team.","ValueSet/care-team-status"
http://hl7.org/fhir/contact-point-system,4.0.1,active,"2.16.840.1.113883.4.642.4.72",ContactPointSystem,ContactPointSystem,"Telecommunications form for contact point.","ValueSet/contact-point-system"
http://hl7.org/fhir/contact-point-use,4.0.1,active,"2.16.840.1.113883.4.642.4.74",ContactPointUse,ContactPointUse,"Use of contact point.","ValueSet/contact-point-use"
http://hl7.org/fhir/diagnostic-report-status,4.0.1,draft,"2.16.840.1.113883.4.642.4.236",DiagnosticReportStatus,DiagnosticReportStatus,"The status of the diagnostic report.","ValueSet/diagnostic-report-status"
http://hl7.org/fhir/document-reference-status,4.0.1,draft,"2.16.840.1.113883.4.642.4.8",DocumentReferenceStatus,DocumentReferenceStatus,"The status of the document reference.","ValueSet/document-reference-status"
http://hl7.org/fhir/event-status,4.0.1,draft,"2.16.840.1.113883.4.642.4.110",EventStatus,EventStatus,"Codes identifying the lifecycle stage of an event.","ValueSet/immunization-status,ValueSet/event-status"
http://hl7.org/fhir/goal-status,4.0.1,draft,"2.16.840.1.113883.4.642.4.272",GoalLifecycleStatus,GoalLifecycleStatus,"Codes that reflect the current state of a goal and whether the goal is still being targeted.","ValueSet/goal-status"
http://hl7.org/fhir/narrative-status,4.0.1,draft,"2.16.840.1.113883.4.642.4.56",NarrativeStatus,NarrativeStatus,"The status of a resource narrative.","ValueSet/us-core-narrative-status"
http://hl7.org/fhir/observation-status,4.0.1,active,"2.16.840.1.113883.4.642.4.401",ObservationStatus,ObservationStatus,"Codes providing the status of an observation.","ValueSet/us-core-observation-smoking-status-status,ValueSet/observation-status"
http://hl7.org/fhir/request-intent,4.0.1,draft,"2.16.840.1.113883.4.642.4.114",RequestIntent,RequestIntent,"Codes indicating the degree of authority/intentionality associated with a request.","ValueSet/care-plan-intent"
http://hl7.org/fhir/request-status,4.0.1,draft,"2.16.840.1.113883.4.642.4.112",RequestStatus,RequestStatus,"Codes identifying the lifecycle stage of a request.","ValueSet/request-status"
http://hl7.org/fhir/sid/cvx,4.0.0,active,"2.16.840.1.113883.12.292",CVX,Vaccine Administered Code Set (CVX),"The CDC's National Center of Immunization and Respiratory Diseases (NCIRD - see [https://www.cdc.gov/ncird/](https://www.cdc.gov/ncird/)) developed and maintains the CVX (vaccine administered) code set. It includes both active and inactive vaccines available in the US. CVX codes for inactive vaccines allow transmission of historical immunization records. When a MVX (manufacturer) code is paired with a CVX (vaccine administered) code, the specific trade named vaccine may be indicated. These codes should be used for immunization messages using either HL7 Version 2.3.1 or HL7 Version 2.5.1. CVX is the underlying Master Code System for V2 table 0292 (Vaccines Administered). The machine readable name for CVX in PHIN VADS is PH_VaccinesAdministeredCVX_CDC_NIP. The version of the CVX code set for certification can be found on the archive page:[https://www2a.cdc.gov/vaccines/iis/iisstandards/mu3versioned_codes.asp](https://www2a.cdc.gov/vaccines/iis/iisstandards/mu3versioned_codes.asp)     The Status column indicates if the vaccine is currently available in the United States.    *  Active: A currently available administrable vaccine     *  Inactive: An administrable vaccine formulation that is no longer available for patient administration, but can be found in historical patient records OR A historical record of a vaccine administered where the exact formulation is unknown     *  Pending: A vaccine that is expected to become active in the future     *  Non-US: A vaccine that available outside the US only     *  Never Active: A vaccine that was never available and is not in the pipeline of new vaccines     The Last Updated column indicates the last time this particular vaccine code was updated in this table.    Questions regarding this table should be directed to the IIS Technical Assistance Team via iisinfo@cdc.gov (or use mailing address via [https://www2a.cdc.gov/vaccines/iis/iisstandards/vaccines.asp?rpt=cvx#addr](https://www2a.cdc.gov/vaccines/iis/iisstandards/vaccines.asp?rpt=cvx#addr))     HL7 Implementers should note that 'Status' IS NOT CONCEPT STATUS as all codes are ACTIVE in this code system.    The current code system is available via [https://www2a.cdc.gov/vaccines/iis/iisstandards/vaccines.asp?rpt=cvx](https://www2a.cdc.gov/vaccines/iis/iisstandards/vaccines.asp?rpt=cvx)","ValueSet/2.16.840.1.113762.1.4.1010.6"
http://hl7.org/fhir/sid/icd-10-cm,2.0.1,active,"2.16.840.1.113883.6.90",Icd10CM,International Classification of Diseases, 10th Revision, Clinical Modification (ICD-10-CM),"The International Classification of Diseases, 10th Revision, Clinical Modification (ICD-10-CM), describes the classification of morbidity and mortality information for statistical purposes and for the indexing of healthcare records by diseases. The ICD-10-CM codes can be used as the value of the Act.cd attribute.","ValueSet/us-core-condition-code-current,ValueSet/us-core-condition-code"
http://hl7.org/fhir/us/core/CodeSystem/condition-category,8.0.0,active,"2.16.840.1.113883.4.642.40.2.16.2",USCoreConditionCategoryExtensionCodes,US Core Condition Category Extension Codes,"Set of codes that are needed for implementation of the US-Core Condition Profile. These codes are used as extensions to the FHIR and US Core value sets.","ValueSet/us-core-problem-or-health-concern"
http://hl7.org/fhir/us/core/CodeSystem/us-core-category,8.0.0,active,"2.16.840.1.113883.4.642.40.2.16.3",USCoreCategory,US Core Category,"Category codes used across US Core Profiles and resource types. They are typically used when there is a need for categorization for searching and finding resources or workflow hints.","ValueSet/us-core-screening-assessment-observation-category,ValueSet/us-core-simple-observation-category,ValueSet/us-core-screening-assessment-condition-category,ValueSet/us-core-servicerequest-category,ValueSet/us-core-screening-assessment-observation-maximum-category"
http://hl7.org/fhir/us/core/CodeSystem/us-core-documentreference-category,8.0.0,active,"2.16.840.1.113883.4.642.40.2.16.4",USCoreDocumentReferencesCategoryCodes,US Core DocumentReferences Category Codes,"The US Core DocumentReferences Type Code System is a 'starter set' of categories supported for fetching and storing DocumentReference Resources.","ValueSet/us-core-documentreference-category"
http://hl7.org/fhir/us/core/CodeSystem/us-core-provenance-participant-type,8.0.0,active,"2.16.840.1.113883.4.642.40.2.16.5",USCoreProvenancePaticipantTypeExtensionCodes,US Core Provenance Participant Type Extension Codes,"Set of codes that are needed for implementation of the US-Core Provenance Profile. These codes are used as extensions to the FHIR value sets.","ValueSet/us-core-provenance-participant-type"
http://ihe.net/fhir/ihe.formatcode.fhir/CodeSystem/formatcode,1.4.0,active,"1.3.6.1.4.1.19376.1.2.3",IHE_FormatCode_codesystem,IHE Format Code set for use with Document Sharing,"The [IHE](http://www.ihe.net) FormatCode code system with canonical URI of http://ihe.net/fhir/ihe.formatcode.fhir/CodeSystem/formatcode is defined to be the set of FormatCodes define by IHE, for use with [Document Sharing](https://profiles.ihe.net/ITI/HIE-Whitepaper/index.html). This code set additionally includes, as deprecated, format codes defined by [HL7 for some Implementation Guides](http://wiki.hl7.org/index.php?title=CDA_Format_Codes_for_IHE_XDS). The HL7 codes are now managed by HL7. The set of IHE FormatCode codes was listed in HITSP C80 Table 2-153 Format Code Value Set Definition, but since has been updated. The use of the FormatCode specifies the technical format of the document. The FormatCode tends to reference the IHE Content Profile (Implementation Guide) that defines the use-case and constraints. The FormatCode is a further specialization more detailed than the mime-type. The FormatCode provides sufficient metadata information to allow any potential document content consumer to know if it can process and/or display by identifying a document encoding, structure and template. The set of codes is intended to be preferred.","ValueSet/v3-HL7FormatCodes"
http://loinc.org,3.1.0,active,"2.16.840.1.113883.6.1",LOINC,Logical Observation Identifiers, Names and Codes (LOINC),"LOINC provides a set of universal names and ID codes for identifying laboratory and clinical test results.1,2 LOINC facilitates the exchange and pooling of results, such as blood hemoglobin, serum potassium, or vital signs, for clinical care, outcomes management, and research. LOINC's universal identifiers (names and codes) can be used in the context of order and observation exchanges between information systems that use syntax standards such as HL73, CEN TC251, ISO TC215, ASTM4, and DICOM. Specifically, the identifier can be used as the coded value for an observation in any other standard that uses the observation/observation value paradigm, whether messages, documents, application programming interface (API), etc. For example, LOINC codes are used widely in the OBX segment Observation Identifier field (OBX-3) of an ORU HL7 (HL7 version 2.x or ASTM 1238-9410) message that may be sent between a Clinical Laboratory Information Management Systems (LIMS) and Electronic Health Record Systems (EHR).5, 6 In this way, LOINC codes provide universal identifiers that allow the exchange of clinical data between heterogeneous computing environments.","ValueSet/us-core-diagnosticreport-category,ValueSet/c80-doc-typecodes,ValueSet/us-core-clinical-note-type,ValueSet/us-core-goal-description,ValueSet/us-core-laboratory-test-codes,ValueSet/us-core-diagnosticreport-report-and-note-codes,ValueSet/us-core-documentreference-type,ValueSet/2.16.840.1.113883.11.20.9.69.4,ValueSet/us-core-procedure-code,ValueSet/2.16.840.1.113883.3.88.12.80.62,ValueSet/2.16.840.1.113762.1.4.1267.13"
http://snomed.info/sct,null,active,"2.16.840.1.113883.6.96",SNOMED_CT,SNOMED CT (all versions),"SNOMED CT is the most comprehensive and precise clinical health terminology product in the world, owned and distributed around the world by The International Health Terminology Standards Development Organisation (IHTSDO).","ValueSet/2.16.840.1.113762.1.4.1166.22,ValueSet/device-kind,ValueSet/2.16.840.1.113762.1.4.1267.3,ValueSet/clinical-findings,ValueSet/us-core-servicerequest-category,ValueSet/2.16.840.1.113762.1.4.1099.54,ValueSet/2.16.840.1.113762.1.4.1021.121,ValueSet/us-core-goal-description,ValueSet/us-core-condition-code-current,ValueSet/us-core-condition-code,ValueSet/immunization-status-reason,ValueSet/us-core-procedure-code,ValueSet/body-site"
http://terminology.hl7.org/CodeSystem/PHOccupationalDataForHealthODH,2.0.1,active,"2.16.840.1.114222.4.5.327",PHOccupationalDataForHealthODH,Occupational Data for Health (ODH),"The concepts representing the values supporting Occupational Data for Health, including Job Supervisory Level or Pay Grade (ODH) code system consists of data elements that describe a person's work information, structured to facilitate individual, population, and public health use; not intended to support billing.).","ValueSet/2.16.840.1.114222.4.11.7900,ValueSet/2.16.840.1.114222.4.11.7901"
http://terminology.hl7.org/CodeSystem/allergyintolerance-clinical,1.0.0,draft,"2.16.840.1.113883.4.642.1.1373",AllergyIntoleranceClinicalStatusCodes,AllergyIntolerance Clinical Status Codes,"Preferred value set for AllergyIntolerance Clinical Status.","ValueSet/allergyintolerance-clinical"
http://terminology.hl7.org/CodeSystem/allergyintolerance-verification,1.0.0,draft,"2.16.840.1.113883.4.642.1.1371",AllergyIntoleranceVerificationStatus,AllergyIntolerance Verification Status,"The verification status to support or decline the clinical status of the allergy or intolerance.","ValueSet/allergyintolerance-verification"
http://terminology.hl7.org/CodeSystem/condition-category,1.0.0,draft,"2.16.840.1.113883.4.642.1.1073",ConditionCategoryCodes,Condition Category Codes,"Preferred value set for Condition Categories.","ValueSet/us-core-problem-or-health-concern"
http://terminology.hl7.org/CodeSystem/condition-clinical,3.0.0,active,"2.16.840.1.113883.4.642.1.1074",ConditionClinicalStatusCodes,Condition Clinical Status Codes,"Preferred value set for Condition Clinical Status.","ValueSet/condition-clinical"
http://terminology.hl7.org/CodeSystem/condition-ver-status,2.0.0,draft,"2.16.840.1.113883.4.642.1.1075",ConditionVerificationStatus,ConditionVerificationStatus,"The verification status to support or decline the clinical status of the condition or diagnosis.","ValueSet/condition-ver-status"
http://terminology.hl7.org/CodeSystem/icd9cm,2.0.1,retired,"2.16.840.1.113883.6.2",Icd9cm,ICD-9CM,"International Classification of Diseases revision 9, with Clinical Modifications (ICD 9 CM)","ValueSet/us-core-condition-code"
http://terminology.hl7.org/CodeSystem/medicationrequest-category,1.0.0,draft,"2.16.840.1.113883.4.642.1.1323",MedicationRequestCategoryCodes,MedicationRequest Category Codes,"MedicationRequest Category Codes","ValueSet/medicationrequest-category"
http://terminology.hl7.org/CodeSystem/nubc-UB92,2.0.1,active,"2.16.840.1.113883.6.21",NubcUB92,National Uniform Billing Council, UB 92,"National Uniform Billing Council, UB 92","ValueSet/v3-USEncounterDischargeDisposition"
http://terminology.hl7.org/CodeSystem/observation-category,1.0.0,draft,"2.16.840.1.113883.4.642.1.1125",ObservationCategoryCodes,Observation Category Codes,"Observation Category codes.","ValueSet/us-core-screening-assessment-observation-category,ValueSet/us-core-simple-observation-category,ValueSet/us-core-clinical-result-observation-category,ValueSet/us-core-screening-assessment-observation-maximum-category"
http://terminology.hl7.org/CodeSystem/provenance-participant-type,1.1.0,active,"2.16.840.1.113883.4.642.1.1131",ProvenanceParticipantType,Provenance participant type,"These codes define the type of participation by an agent in a provenance activity. An agent is something that bears the responsibility identified by the type of participation in the activity taking place, for the existence of an entity, or for another agent's activity. An Agent may be An agent, device, system, organization, group, care-team, or other identifiable thing.","ValueSet/us-core-provenance-participant-type"
http://terminology.hl7.org/CodeSystem/subscriber-relationship,1.0.0,draft,"2.16.840.1.113883.4.642.1.1386",SubscriberRelationshipCodes,SubscriberPolicyholder Relationship Codes,"This value set includes codes for the relationship between the Subscriber and the Beneficiary (insured/covered party/patient).","ValueSet/subscriber-relationship"
http://terminology.hl7.org/CodeSystem/v2-0131,2.0.0,active,"2.16.840.1.113883.18.58",ContactRole2,contactRole2,"Code system of concepts which specify a relationship role that the next of kin/associated parties plays with regard to the patient. Also used in referrals, for example, it may be necessary to identify the contact representative at the clinic that sent a referral. Used in HL7 Version 2 messaging in the NK1 and CTD segments after 2.5, when it replace 2.16.840.1.113883.18.57.","ValueSet/relatedperson-relationshiptype"
http://terminology.hl7.org/CodeSystem/v3-ActCode,9.0.0,active,"2.16.840.1.113883.5.4",ActCode,ActCode,"A code specifying the particular kind of Act that the Act-instance represents within its class.    *Constraints:* The kind of Act (e.g. physical examination, serum potassium, inpatient encounter, charge financial transaction, etc.) is specified with a code from one of several, typically external, coding systems. The coding system will depend on the class of Act, such as LOINC for observations, etc.    Conceptually, the Act.code must be a specialization of the Act.classCode. This is why the structure of ActClass domain should be reflected in the superstructure of the ActCode domain and then individual codes or externally referenced vocabularies subordinated under these domains that reflect the ActClass structure.    Act.classCode and Act.code are not modifiers of each other but the Act.code concept should really imply the Act.classCode concept. For a negative example, it is not appropriate to use an Act.code ""potassium"" together with and Act.classCode for ""laboratory observation"" to somehow mean ""potassium laboratory observation"" and then use the same Act.code for ""potassium"" together with Act.classCode for ""medication"" to mean ""substitution of potassium"". This mutually modifying use of Act.code and Act.classCode is not permitted.","ValueSet/v3-ActPharmacySupplyType"
http://terminology.hl7.org/CodeSystem/v3-ActReason,3.1.0,active,"2.16.840.1.113883.5.8",ActReason,ActReason,"A set of codes specifying the motivation, cause, or rationale of an Act, when such rationale is not reasonably represented as an ActRelationship of type ""has reason"" linking to another Act.    *Examples:* Example reasons that might qualify for being coded in this field might be: ""routine requirement"", ""infectious disease reporting requirement"", ""on patient request"", ""required by law"".","ValueSet/immunization-status-reason"
http://terminology.hl7.org/CodeSystem/v3-HL7DocumentFormatCodes,4.1.0,active,"2.16.840.1.113883.4.642.1.1407",HL7DocumentFormatCodes,HL7 Document Format Codes,"This codeSystem contains codes which specify the technical format of a document. Each code provides sufficient information to allow any potential document consumer to know if it will be able to process the document. The codes are sufficiently specific to ensure processing/display by identifying a document encoding, structure and template. For example, formatCodes can be used in the FHIR DocumentReference resource to characterize the document being referenced.","ValueSet/v3-HL7FormatCodes"
http://terminology.hl7.org/CodeSystem/v3-NullFlavor,3.0.0,active,"2.16.840.1.113883.5.1008",NullFlavor,NullFlavor,"A collection of codes specifying why a valid value is not present.","ValueSet/us-core-documentreference-type"
http://terminology.hl7.org/CodeSystem/v3-ObservationInterpretation,3.0.0,active,"2.16.840.1.113883.5.83",ObservationInterpretation,ObservationInterpretation,"One or more codes providing a rough qualitative interpretation of the observation, such as ""normal"" / ""abnormal"", ""low"" / ""high"", ""better"" / ""worse"", ""resistant"" / ""susceptible"", ""expected"" / ""not expected"". The value set is intended to be for ANY use where coded representation of an interpretation is needed.","ValueSet/observation-interpretation"
http://terminology.hl7.org/CodeSystem/v3-RoleCode,3.0.0,active,"2.16.840.1.113883.5.111",RoleCode,RoleCode,"A set of codes further specifying the kind of Role; specific classification codes for further qualifying RoleClass codes.","ValueSet/relatedperson-relationshiptype,ValueSet/v3-ServiceDeliveryLocationRoleType"
http://terminology.hl7.org/CodeSystem/v3-TribalEntityUS,4.0.0,active,"2.16.840.1.113883.5.140",TribalEntityUS,TribalEntityUS,"INDIAN ENTITIES RECOGNIZED AND ELIGIBLE TO RECEIVE SERVICES FROM THE UNITED STATES BUREAU OF INDIAN AFFAIRS","ValueSet/v3-TribalEntityUS"
http://unitsofmeasure.org,3.0.1,active,"2.16.840.1.113883.6.8",UCUM,Unified Code for Units of Measure (UCUM),"The Unified Code for Units of Measure (UCUM) is a code system intended to include all units of measures being contemporarily used in international science, engineering, and business. The purpose is to facilitate unambiguous electronic communication of quantities together with their units. The focus is on electronic communication, as opposed to communication between humans. A typical application of The Unified Code for Units of Measure are electronic data interchange (EDI) protocols, but there is nothing that prevents it from being used in other types of machine communication.","ValueSet/ucum-bodyweight,ValueSet/ucum-bodytemp,ValueSet/ucum-common,ValueSet/ucum-vitals-common,ValueSet/ucum-bodylength,ValueSet/v3-UnitsOfMeasureCaseSensitive"
http://www.ada.org/cdt,3.0.1,active,"2.16.840.1.113883.6.13",CDT,Code on Dental Procedures and Nomenclature,"The purpose of the CDT Code is to achieve uniformity, consistency and specificity in accurately documenting dental treatment. One use of the CDT Code is to provide for the efficient processing of dental claims, and another is to populate an Electronic Health Record.","ValueSet/us-core-procedure-code"
http://www.ama-assn.org/go/cpt,3.0.1,active,"2.16.840.1.113883.6.12",CPT,Current Procedural Terminology (CPT®),"The Current Procedural Terminology (CPT) code set, created and maintained by the American Medical Association, is the language of medicine today and the code to its future. This system of terminology is the most widely accepted medical nomenclature used to report medical procedures and services under public and private health insurance programs. CPT coding is also used for administrative management purposes such as claims processing and developing guidelines for medical care review. Each year, via a rigorous, evidence-based and transparent process, the independent CPT Editorial Panel revises, creates or deletes hundreds of codes in order to reflect current medical practice.    Designated by the U.S. Department of Health and Human Services under the Health Insurance Portability and Accountability Act (HIPAA) as a national coding set for physician and other health care professional services and procedures, CPT’s evidence-based codes accurately encompass the full range of health care services.    All CPT codes are five-digits and can be either numeric or alphanumeric, depending on the category. CPT code descriptors are clinically focused and utilize common standards so that a diverse set of users can have common understanding across the clinical health care paradigm.    There are various types of CPT codes:    Category I: These codes have descriptors that correspond to a procedure or service. Codes range from 00100–99499 and are generally ordered into sub-categories based on procedure/service type and anatomy.    Category II: These alphanumeric tracking codes are supplemental codes used for performance measurement. Using them is optional and not required for correct coding.    Category III: These are temporary alphanumeric codes for new and developing technology, procedures and services. They were created for data collection, assessment and in some instances, payment of new services and procedures that currently don’t meet the criteria for a Category I code.    Proprietary Laboratory Analyses (PLA) codes: These codes describe proprietary clinical laboratory analyses and can be either provided by a single (“solesource”) laboratory or licensed or marketed to multiple providing laboratories that are cleared or approved by the Food and Drug Administration (FDA)). This category includes but is not limited to Advanced Diagnostic Laboratory Tests (ADLTs) and Clinical Diagnostic Laboratory Tests (CDLTs), as defined under the Protecting Access to Medicare Act of 2014 (PAMA).","ValueSet/us-core-procedure-code"
http://www.cms.gov/Medicare/Coding/ICD10,2.0.1,active,"2.16.840.1.113883.6.4",Icd10PCS,ICD-10 Procedure Codes,"ICD Procedure Coding System (ICD 10 PCS)","ValueSet/us-core-procedure-code"
https://nahdo.org/sopt,9.2,active,"2.16.840.1.113883.3.221.5",SOP,Source of Payment Typology,"","ValueSet/2.16.840.1.114222.4.11.3591"
https://www.cms.gov/Medicare/Coding/place-of-service-codes/Place_of_Service_Code_Set,20240502,active,"2.16.840.1.113883.15.5",CMSPlaceofServiceCodes,CMS Place of Service Codes (POS),"Place of Service Codes are two-digit codes placed on health care professional claims to indicate the setting in which a service was provided. The Centers for Medicare & Medicaid Services (CMS) maintain POS codes used throughout the health care industry.    This code set is required for use in the implementation guide adopted as the national standard for electronic transmission of professional health care claims under the provisions of the Health Insurance Portability and Accountability Act of 1996 (HIPAA). HIPAA directed the Secretary of HHS to adopt national standards for electronic transactions. These standard transactions require all health plans and providers to use standard code sets to populate data elements in each transaction. The Transaction and Code Set Rule adopted the ASC X12N-837 Health Care Claim: Professional, volumes 1 and 2, as the standard for electronic submission of professional claims. This standard names the POS code set currently maintained by CMS as the code set to be used for describing sites of service in such claims. POS information is often needed to determine the acceptability of direct billing of Medicare, Medicaid and private insurance services provided by a given provider.","ValueSet/CMSPlaceOfServiceCodes"
https://www.usps.com/,1.0.0,active,,USPSStateCodes,USPS State Codes,"State Codes as defined by US Postal Service    For more information, see [https://pe.usps.com/text/pub28/28apb.htm](https://pe.usps.com/text/pub28/28apb.htm)","ValueSet/USPS-State"
