URL,Version,Status,OIDs,Name,Title,Descriptino,Uses,Used,Sources
http://hl7.org/fhir/us/core/ValueSet/us-core-observation-smoking-status-status,8.0.0,active,"2.16.840.1.113883.4.642.40.2.48.9",USCoreObservationSmokingStatusStatus,US Core Status for Smoking Status Observation,"Codes providing the status of an observation for smoking status. Constrained to `final`and `entered-in-error`.","StructureDefinition/us-core-smokingstatus","hl7.fhir.r4.core"
http://hl7.org/fhir/us/core/ValueSet/us-core-problem-or-health-concern,8.0.0,active,"2.16.840.1.113883.4.642.40.2.48.19",USCoreProblemOrHealthConcern,US Core Problem or Health Concern,"Code set for category codes for *US Core Condition Problems and Health Concerns Profile* consisting of the concepts ""problem"" and ""health-concern"".","StructureDefinition/us-core-condition-problems-health-concerns","Internal,THO"
http://hl7.org/fhir/us/core/ValueSet/us-core-procedure-code,8.0.0,active,"2.16.840.1.113883.4.642.40.2.48.20",USCoreProcedureCodes,US Core Procedure Codes,"Concepts from CPT, SNOMED CT, HCPCS Level II Alphanumeric Codes, ICD-10-PCS,CDT and LOINC code systems that can be used to indicate the type of procedure performed.","StructureDefinition/us-core-procedure,StructureDefinition/us-core-servicerequest","hl7.terminology,SCT,LOINC,Other"
http://hl7.org/fhir/us/core/ValueSet/us-core-provenance-participant-type,8.0.0,active,"2.16.840.1.113883.4.642.40.2.48.10",USCoreProvenancePaticipantTypeCodes,US Core Provenance Participant Type Codes,"The type of participation a provenance agent played for a given target.","StructureDefinition/us-core-provenance","Internal,THO"
http://hl7.org/fhir/us/core/ValueSet/us-core-screening-assessment-condition-category,8.0.0,active,"2.16.840.1.113883.4.642.40.2.48.11",USCoreScreeningAssessmentConditionCategory,US Core Screening Assessment Condition Category,"This value set consists of the single code ""sdoh"". It is the minimum value set of category codes used in the US Core Condition Problems and Health Concerns Profile that any conformant system **SHALL** support to help identify the type of USCDI Health Status/Assessment data class being reported.",,"Internal"
http://hl7.org/fhir/us/core/ValueSet/us-core-screening-assessment-observation-category,8.0.0,active,"2.16.840.1.113883.4.642.40.2.48.12",USCoreScreeningAssessmentObservationCategory,US Core Screening Assessment Observation Category,"This value set is the minimum value set of category codes used in the US Core Observation Screening Assessment and Simple Observation Profiles that any conformant system **SHALL** support to help identify the type of USCDI Health Status/Assessment data class being reported.","StructureDefinition/us-core-condition-problems-health-concerns,StructureDefinition/us-core-observation-screening-assessment","Internal,THO"
http://hl7.org/fhir/us/core/ValueSet/us-core-screening-assessment-observation-maximum-category,8.0.0,active,"2.16.840.1.113883.4.642.40.2.48.13",USCoreScreeningAssessmentObservationMaximumCategory,US Core Screening Assessment Observation Maximum Category,"This value set is a value set of category codes used in the US Core Observation Screening Assessment that any conformant system **SHOULD** support to help identify the type of USCDI Health Status/Assessment data class being reported.","StructureDefinition/us-core-observation-screening-assessment","Internal,THO"
http://hl7.org/fhir/us/core/ValueSet/us-core-servicerequest-category,8.0.0,active,"2.16.840.1.113883.4.642.40.2.48.21",USCoreServiceRequestCategoryCodes,US Core ServiceRequest Category Codes,"A set of SNOMED CT and LOINC concepts to classify a requested service","StructureDefinition/us-core-servicerequest","SCT,Internal"
http://hl7.org/fhir/us/core/ValueSet/us-core-simple-observation-category,8.0.0,active,"2.16.840.1.113883.4.642.40.2.48.14",USCoreSimpleObservationCategory,US Core Simple Observation Category,"This value set is a value set of category codes used in the US Core Simple Observation and Condition Problems and Health Concerns Profiles that any conformant system **SHOULD** support to help identify the type of USCDI Health Status/Assessment data class being reported.","StructureDefinition/us-core-condition-problems-health-concerns,StructureDefinition/us-core-care-experience-preference,StructureDefinition/us-core-treatment-intervention-preference,StructureDefinition/us-core-observation-adi-documentation,StructureDefinition/us-core-simple-observation","Internal,THO"
http://hl7.org/fhir/us/core/ValueSet/us-core-specimen-condition,8.0.0,active,"2.16.840.1.113883.4.642.40.2.48.15",USCoreSpecimenCondition,US Core Specimen Condition,"This value set contains concepts the provide information regarding a specimen, including the container, that does not meet a laboratory’s criteria for acceptability.","StructureDefinition/us-core-specimen",
http://phinvads.cdc.gov/fhir/ValueSet/2.16.840.1.114222.4.11.7900,1,active,,PHVS_Industry_NAICS_Detail _ODH,Industry NAICS Detail (ODH),"The Industry NAICS Detail (ODH) value set is to be used to capture self-reported industry within electronic health information systems to support direct patient care, population health and public health activities.  Industry is described as the economic or business sector of a business or enterprise.  For more information, a mapping to 2012 Census Industry Codes, and tips on using this value set go to the Occupational Data for Health (ODH) Hot Topics section on the PHIN VADS home page.","StructureDefinition/us-core-observation-occupation","THO"
http://phinvads.cdc.gov/fhir/ValueSet/2.16.840.1.114222.4.11.7901,1,active,,PHVS_Occupation_ONETSOC_Detail_ODH,Occupation ONETSOC Detail (ODH),"The Occupation ONETSOC Detail (ODH) value set is to be used to capture self-reported occupation within electronic health information systems to support direct patient care, population health and public health activities.  Occupation is the type of work done by the subject.  It is based on the 2010 O*Net-SOC Classification System.  For more information, a mapping to 2010 Census Codes, and tips on using this value set go to the Occupational Data for Health (ODH) Hot Topics section on the PHIN VADS home page.","StructureDefinition/us-core-observation-occupation","THO"
http://terminology.hl7.org/ValueSet/CMSPlaceOfServiceCodes,1.0.0,active,,CMSPlaceOfServiceCodes,CMS Place of Service Codes (POS),"This is the all codes value set for the CMS POS code system.","StructureDefinition/us-core-location","hl7.terminology.r4"
http://terminology.hl7.org/ValueSet/Languages,1.0.0,active,,Languages,Languages,"This value set defines a set of codes for the representation of the names of languages. It uses the list of ISO 639-2 concepts using the ISO 639-1 2-digit code for a concept where possible and the 3-digit terminological code where there is no  2-digit code.","StructureDefinition/us-core-patient","hl7.terminology"
http://terminology.hl7.org/ValueSet/USPS-State,1.0.0,active,,UspsTwoLetterAlphabeticCodes,USPS Two Letter Alphabetic Codes,"This value set defines two letter USPS alphabetic codes.","StructureDefinition/us-core-practitioner,StructureDefinition/us-core-patient,StructureDefinition/us-core-location,StructureDefinition/us-core-jurisdiction,StructureDefinition/us-core-organization","hl7.terminology.r4"
http://terminology.hl7.org/ValueSet/v2-0493,2.0.0,active,"2.16.840.1.113883.21.333",Hl7VSSpecimenCondition,hl7VS-specimenCondition,"Concepts of modes or states of being that describe the nature of a specimen.  Used in Version 2 messaging in the SPM segment.","ValueSet/us-core-specimen-condition","THO (V2)"
http://terminology.hl7.org/ValueSet/v3-ActPharmacySupplyType,3.0.0,active,"2.16.840.1.113883.1.11.16208",ActPharmacySupplyType,ActPharmacySupplyType,"Identifies types of dispensing events","StructureDefinition/us-core-medicationdispense","THO (V3)"
http://terminology.hl7.org/ValueSet/v3-HL7FormatCodes,2.1.0,active,"2.16.840.1.113883.11.19752",HL7FormatCodes,HL7 ValueSet of Format Codes for use with Document Sharing,"The HL7-FormatCodes value set is defined to be the set of FormatCode(s) defined by implementation guides published by HL7 and other SDOs. The use of a formatCode from the FormatCodes value set specifies the technical format that a document conforms to. The formatCode is a further specialization more detailed than the mime-type. The formatCode provides sufficient information to allow any potential document content consumer to know if it can process and/or display the content of the document based on the document encoding, structure and template conformance indicated by the formatCode. The set of formatCodes is intended to be extensible. The Content Logical Description is defined intentionally to permit formatCodes defined by other Standards Development Organizations to be added by inclusion of additional formatCode Code Systems.","StructureDefinition/us-core-adi-documentreference,StructureDefinition/us-core-documentreference","THO (V3),Other"
http://terminology.hl7.org/ValueSet/v3-ServiceDeliveryLocationRoleType,3.0.0,active,"2.16.840.1.113883.1.11.17660",ServiceDeliveryLocationRoleType,ServiceDeliveryLocationRoleType,"A role of a place that further classifies the setting (e.g., accident site, road side, work site, community location) in which services are delivered.","StructureDefinition/us-core-location","THO (V3)"
http://terminology.hl7.org/ValueSet/v3-TribalEntityUS,4.0.0,active,"2.16.840.1.113883.1.11.11631",TribalEntityUS,TribalEntityUS,"INDIAN ENTITIES RECOGNIZED AND ELIGIBLE TO RECEIVE SERVICES FROM THE UNITED STATES BUREAU OF INDIAN AFFAIRS","StructureDefinition/us-core-tribal-affiliation","THO (V3)"
http://terminology.hl7.org/ValueSet/v3-USEncounterDischargeDisposition,3.0.0,active,"2.16.840.1.113883.1.11.19453",USEncounterDischargeDisposition,USEncounterDischargeDisposition,"***No description***","StructureDefinition/us-core-encounter","THO"
http://terminology.hl7.org/ValueSet/v3-UnitsOfMeasureCaseSensitive,3.0.0,active,"2.16.840.1.113883.1.11.12839",UnitsOfMeasureCaseSensitive,UnitsOfMeasureCaseSensitive,"**Description:** All units of measure.","StructureDefinition/us-core-smokingstatus","UCUM"
